{
  "schema_version": 1,
  "revision": "provider-integrations-2026-09-05.1",
  "verified_on": "2026-09-05",
  "finance_capability_names": ["cash_balance", "plan_quota", "usage", "cost", "rate_limits", "spending_limit"],
  "finance_access_modes": ["direct_api", "admin_api", "cloud_billing_api", "console_only", "not_applicable", "unknown"],
  "provider_accounts": [
    {
      "id": "alibaba",
      "display_name": "Alibaba Cloud Model Studio",
      "inference": {
        "protocols": ["openai_compatible", "dashscope_native", "anthropic_compatible"],
        "sites": [
          {"id": "singapore-global", "region": "ap-southeast-1", "base_url": "https://dashscope-intl.aliyuncs.com/compatible-mode/v1", "status": "documented"},
          {"id": "regional-workspace", "region": "provider-selected", "base_url": "https://{workspace_id}.{region}.maas.aliyuncs.com/compatible-mode/v1", "status": "template"}
        ],
        "model_discovery": {"mode": "api", "method": "GET", "endpoint": "https://dashscope-intl.aliyuncs.com/api/v1/models", "operation": null, "credential_scope": "inference"}
      },
      "credentials": {
        "inference": {"credential_ref": "kv-infra-shared/data/llm/qwen", "auth_scheme": "bearer", "header_name": "Authorization", "value_prefix": "Bearer "},
        "admin_finance": {"credential_ref": "kv-infra-shared/data/llm-admin/providers/alibaba", "auth_scheme": "alibaba_rpc_signature", "header_name": null, "value_prefix": null}
      },
      "financial_capabilities": {"cash_balance": "cloud_billing_api", "plan_quota": "unknown", "usage": "cloud_billing_api", "cost": "cloud_billing_api", "rate_limits": "console_only", "spending_limit": "unknown"},
      "finance_endpoints": [
        {"capabilities": ["cash_balance"], "access": "cloud_billing_api", "method": "POST", "endpoint": "https://business.aliyuncs.com", "operation": "QueryAccountBalance", "credential_scope": "admin_finance"},
        {"capabilities": ["usage", "cost"], "access": "cloud_billing_api", "method": "POST", "endpoint": "https://business.aliyuncs.com", "operation": "QueryBill", "credential_scope": "admin_finance"}
      ],
      "official_sources": [
        {"title": "Model Studio API keys and regions", "url": "https://www.alibabacloud.com/help/en/model-studio/get-api-key", "verified_on": "2026-09-05"},
        {"title": "ListModels", "url": "https://www.alibabacloud.com/help/en/model-studio/list-models", "verified_on": "2026-09-05"},
        {"title": "QueryAccountBalance", "url": "https://www.alibabacloud.com/help/en/user-center/developer-reference/api-bssopenapi-2017-12-14-queryaccountbalance", "verified_on": "2026-09-05"}
      ],
      "limitations": ["Inference endpoints and keys are scoped to a region or workspace.", "The billing identity must be separate and read-only."]
    },
    {
      "id": "z-ai",
      "display_name": "Z.ai / Zhipu",
      "inference": {
        "protocols": ["openai_compatible", "anthropic_compatible"],
        "sites": [
          {"id": "general", "region": "global", "base_url": "https://api.z.ai/api/paas/v4", "status": "documented"},
          {"id": "coding-plan", "region": "global", "base_url": "https://api.z.ai/api/coding/paas/v4", "status": "documented"}
        ],
        "model_discovery": {"mode": "unverified", "method": null, "endpoint": null, "operation": null, "credential_scope": "none"}
      },
      "credentials": {
        "inference": {"credential_ref": "kv-infra-shared/data/llm/providers/z-ai", "auth_scheme": "bearer", "header_name": "Authorization", "value_prefix": "Bearer "},
        "admin_finance": {"credential_ref": null, "auth_scheme": "none", "header_name": null, "value_prefix": null}
      },
      "financial_capabilities": {"cash_balance": "console_only", "plan_quota": "console_only", "usage": "console_only", "cost": "console_only", "rate_limits": "console_only", "spending_limit": "console_only"},
      "finance_endpoints": [],
      "official_sources": [
        {"title": "Chat completion", "url": "https://docs.z.ai/api-reference/llm/chat-completion", "verified_on": "2026-09-05"},
        {"title": "Rate limits", "url": "https://docs.z.ai/api-reference/rate-limit", "verified_on": "2026-09-05"}
      ],
      "limitations": ["General and Coding Plan keys and base URLs are not interchangeable.", "No public model-list or account-balance endpoint was verified."]
    },
    {
      "id": "mistral-ai",
      "display_name": "Mistral AI",
      "inference": {
        "protocols": ["openai_compatible"],
        "sites": [{"id": "global", "region": "global", "base_url": "https://api.mistral.ai/v1", "status": "documented"}],
        "model_discovery": {"mode": "api", "method": "GET", "endpoint": "https://api.mistral.ai/v1/models", "operation": null, "credential_scope": "inference"}
      },
      "credentials": {
        "inference": {"credential_ref": "kv-infra-shared/data/llm/providers/mistral-ai", "auth_scheme": "bearer", "header_name": "Authorization", "value_prefix": "Bearer "},
        "admin_finance": {"credential_ref": "kv-infra-shared/data/llm-admin/providers/mistral-ai", "auth_scheme": "x_api_key", "header_name": "x-api-key", "value_prefix": null}
      },
      "financial_capabilities": {"cash_balance": "console_only", "plan_quota": "not_applicable", "usage": "admin_api", "cost": "admin_api", "rate_limits": "admin_api", "spending_limit": "admin_api"},
      "finance_endpoints": [
        {"capabilities": ["usage", "cost"], "access": "admin_api", "method": "GET", "endpoint": "https://api.mistral.ai/v1/admin/usage", "operation": null, "credential_scope": "admin_finance"},
        {"capabilities": ["rate_limits"], "access": "admin_api", "method": "GET", "endpoint": "https://api.mistral.ai/v1/admin/rate-limit", "operation": null, "credential_scope": "admin_finance"},
        {"capabilities": ["spending_limit"], "access": "admin_api", "method": "GET", "endpoint": "https://api.mistral.ai/v1/admin/spend-limit", "operation": null, "credential_scope": "admin_finance"}
      ],
      "official_sources": [
        {"title": "Models API", "url": "https://docs.mistral.ai/api/endpoint/models", "verified_on": "2026-09-05"},
        {"title": "Admin usage metrics", "url": "https://docs.mistral.ai/admin/admin-api/usage-metrics", "verified_on": "2026-09-05"},
        {"title": "Billing and usage", "url": "https://docs.mistral.ai/admin/billing-usage/billing", "verified_on": "2026-09-05"}
      ],
      "limitations": ["Credit balance remains console-only.", "Family labels such as Small or Large must be resolved to a current alias or pinned version."]
    },
    {
      "id": "deepseek",
      "display_name": "DeepSeek",
      "inference": {
        "protocols": ["openai_compatible", "anthropic_compatible"],
        "sites": [{"id": "global", "region": "global", "base_url": "https://api.deepseek.com", "status": "documented"}],
        "model_discovery": {"mode": "api", "method": "GET", "endpoint": "https://api.deepseek.com/models", "operation": null, "credential_scope": "inference"}
      },
      "credentials": {
        "inference": {"credential_ref": "kv-infra-shared/data/llm/deepseek", "auth_scheme": "bearer", "header_name": "Authorization", "value_prefix": "Bearer "},
        "admin_finance": {"credential_ref": null, "auth_scheme": "none", "header_name": null, "value_prefix": null}
      },
      "financial_capabilities": {"cash_balance": "direct_api", "plan_quota": "not_applicable", "usage": "unknown", "cost": "unknown", "rate_limits": "unknown", "spending_limit": "unknown"},
      "finance_endpoints": [{"capabilities": ["cash_balance"], "access": "direct_api", "method": "GET", "endpoint": "https://api.deepseek.com/user/balance", "operation": null, "credential_scope": "inference"}],
      "official_sources": [
        {"title": "List models", "url": "https://api-docs.deepseek.com/api/list-models/", "verified_on": "2026-09-05"},
        {"title": "Get user balance", "url": "https://api-docs.deepseek.com/api/get-user-balance/", "verified_on": "2026-09-05"},
        {"title": "Error codes", "url": "https://api-docs.deepseek.com/quick_start/error_codes/", "verified_on": "2026-09-05"}
      ],
      "limitations": ["The balance endpoint is account-scoped, not model-scoped.", "No aggregate usage or spending-limit endpoint was verified."]
    },
    {
      "id": "minimax",
      "display_name": "MiniMax",
      "inference": {
        "protocols": ["openai_compatible", "anthropic_compatible"],
        "sites": [
          {"id": "global", "region": "global", "base_url": "https://api.minimax.io/v1", "status": "documented"},
          {"id": "china", "region": "cn", "base_url": "https://api.minimaxi.com/v1", "status": "documented"}
        ],
        "model_discovery": {"mode": "api", "method": "GET", "endpoint": "https://api.minimax.io/v1/models", "operation": null, "credential_scope": "inference"}
      },
      "credentials": {
        "inference": {"credential_ref": "kv-infra-shared/data/llm/providers/minimax", "auth_scheme": "bearer", "header_name": "Authorization", "value_prefix": "Bearer "},
        "admin_finance": {"credential_ref": null, "auth_scheme": "none", "header_name": null, "value_prefix": null}
      },
      "financial_capabilities": {"cash_balance": "console_only", "plan_quota": "direct_api", "usage": "console_only", "cost": "console_only", "rate_limits": "console_only", "spending_limit": "console_only"},
      "finance_endpoints": [{"capabilities": ["plan_quota"], "access": "direct_api", "method": "GET", "endpoint": "https://www.minimax.io/v1/token_plan/remains", "operation": null, "credential_scope": "inference"}],
      "official_sources": [
        {"title": "List models", "url": "https://platform.minimax.io/docs/api-reference/models/openai/list-models", "verified_on": "2026-09-05"},
        {"title": "Token Plan FAQ", "url": "https://platform.minimax.io/docs/token-plan/faq", "verified_on": "2026-09-05"},